{
  "$schema": "https://json-schema.org/draft/2020-12/schema",
  "$id": "https://matchbox.local/schemas/job-requirements.v1.json",
  "title": "Job requirements extracted from a JD",
  "$defs": {
    "RequirementItem": {
      "additionalProperties": false,
      "properties": {
        "type": {
          "enum": [
            "must-have",
            "responsibility",
            "nice"
          ],
          "type": "string"
        },
        "text": {
          "minLength": 1,
          "type": "string"
        },
        "keywords": {
          "description": "Verbatim or near-verbatim phrases from the JD that a literal ATS would search for.",
          "items": {
            "type": "string"
          },
          "type": "array"
        },
        "variants": {
          "description": "Accepted equivalents for the ATS keyword-presence check (e.g. 'K8s' counts for 'Kubernetes').",
          "items": {
            "type": "string"
          },
          "type": "array"
        }
      },
      "required": [
        "type",
        "text"
      ],
      "type": "object"
    }
  },
  "additionalProperties": false,
  "description": "Written by the brain (via `python -m matchbox.jobreqs save`). Cached in job.requirements_json with a model_version tag. The matching pipeline scores each library component against each requirement.",
  "properties": {
    "schema_version": {
      "const": 1,
      "type": "integer"
    },
    "job_id": {
      "minimum": 1,
      "type": "integer"
    },
    "model_version": {
      "description": "Identifier for the model/prompt that produced these requirements. Changing this triggers a clean recompute of cached vectors.",
      "type": "string"
    },
    "jd_hash": {
      "anyOf": [
        {
          "type": "string"
        },
        {
          "type": "null"
        }
      ],
      "default": null,
      "description": "SHA-256 of the JD text the brain extracted from. Lets the app detect a stale cache when the JD is edited."
    },
    "requirements": {
      "items": {
        "$ref": "#/$defs/RequirementItem"
      },
      "minItems": 1,
      "type": "array"
    }
  },
  "required": [
    "schema_version",
    "job_id",
    "model_version",
    "requirements"
  ],
  "type": "object"
}
