{
  "schema_version": 1,
  "job_id": 1,
  "model_version": "livefire-handcrafted",
  "requirements": [
    {
      "type": "must-have",
      "text": "Build and operate data pipelines (ETL).",
      "keywords": ["pipelines", "etl"],
      "variants": []
    },
    {
      "type": "must-have",
      "text": "Operate Kubernetes clusters in production.",
      "keywords": ["kubernetes"],
      "variants": ["k8s"]
    },
    {
      "type": "responsibility",
      "text": "Mentor engineers.",
      "keywords": ["mentor"],
      "variants": []
    },
    {
      "type": "must-have",
      "text": "Strong Python.",
      "keywords": ["python"],
      "variants": []
    }
  ]
}
